[
  {
    "name": "Claude",
    "icon": "simple-icons:claude",
    "link": "https://claude.ai",
    "yearsOfExperience": 1
  },
  {
    "name": "Unity",
    "icon": "bi:unity",
    "link": "https://unity.com",
    "yearsOfExperience": 6
  },
  {
    "name": "Godot",
    "icon": "devicon-plain:godot",
    "link": "https://godotengine.org",
    "yearsOfExperience": 0
  },
  {
    "name": "Bevy",
    "icon": "simple-icons:bevy",
    "link": "https://bevyengine.org",
    "yearsOfExperience": 0
  },
  {
    "name": "raylib",
    "icon": "simple-icons:raylib",
    "link": "https://raylib.com",
    "yearsOfExperience": 0
  },
  {
    "name": "Visual Studio",
    "icon": "uil:visual-studio",
    "link": "https://visualstudio.com",
    "yearsOfExperience": 6
  },
  {
    "name": "Visual Studio Code",
    "icon": "cib:visual-studio-code",
    "link": "https://code.visualstudio.com",
    "yearsOfExperience": 5
  },
  {
    "name": "Notepad++",
    "icon": "simple-icons:notepadplusplus",
    "link": "https://notepad-plus-plus.org",
    "yearsOfExperience": 2
  },
  {
    "name": "GitHub",
    "icon": "mdi:github",
    "link": "https://github.com",
    "yearsOfExperience": 5
  },
  {
    "name": "GitLab",
    "icon": "ri:gitlab-fill",
    "link": "https://gitlab.com",
    "yearsOfExperience": 0
  },
  {
    "name": "GitKraken",
    "icon": "simple-icons:gitkraken",
    "link": "https://www.gitkraken.com",
    "yearsOfExperience": 3
  },
  {
    "name": "Milanote",
    "icon": "simple-icons:milanote",
    "link": "https://milanote.com",
    "yearsOfExperience": 3
  },
  {
    "name": "سبورة مادية",
    "icon": "fluent:whiteboard-20-filled",
    "link": "https://www.absoluteofficecomforts.com.au/wp-content/uploads/2019/01/Whiteboard-Porcelain-1000x759.png",
    "yearsOfExperience": 5
  }
]
